{
  "id": "usc-title-20-section-1681",
  "title": "20 U.S.C. 1681: Sex",
  "short_title": "20 U.S.C. 1681",
  "artifact_type": "U.S. Code",
  "domain": "policy",
  "authority_level": "us_code",
  "hierarchy_rank": 20,
  "family": "usc_title_20",
  "jurisdiction": "United States",
  "issuing_authority": "Congress",
  "issuing_organization": "Office of the Law Revision Counsel",
  "source_system": "U.S. Code",
  "source_location_type": "us_code_html",
  "source_url": "https://uscode.house.gov/view.xhtml?req=granuleid:USC-prelim-title20-section1681&num=0&edition=prelim",
  "source_mime_type": "text/html;charset=UTF-8",
  "source_date": null,
  "publication_date": null,
  "effective_date": null,
  "captured_at": "2026-06-15T02:55:46.256Z",
  "checksum_sha256": "4d7adec358fe3ea99ca461a91158f05f234bf80f9caed4f150e0c1f1c01eaf9a",
  "raw_path": "artifacts/usc-title-20-section-1681/raw/source.html",
  "extracted_text_path": "artifacts/usc-title-20-section-1681/text/extracted.txt",
  "metadata_path": "artifacts/usc-title-20-section-1681/metadata/metadata.json",
  "analytics_path": "artifacts/usc-title-20-section-1681/analytics/document-metrics.json",
  "analysis_path": "artifacts/usc-title-20-section-1681/analysis/machine-analysis.json",
  "structured_json_path": "artifacts/usc-title-20-section-1681/structured/summary.json",
  "version_index_path": "artifacts/usc-title-20-section-1681/versions/index.json",
  "pipeline_state": "structured",
  "mirror_status": "mirrored",
  "parser_status": "parsed",
  "review_status": "machine_reviewed",
  "tags": [
    "statute",
    "us-code",
    "title-20",
    "section-1681",
    "reference-ingestion"
  ],
  "analytic_lanes": [
    "authority_lineage",
    "obligation_extraction",
    "deadline_detection",
    "defined_terms",
    "issuing_org_graph",
    "implementation_tasks",
    "supersession_tracking",
    "compliance_evidence",
    "entity_reference_concept_extraction",
    "line_annotation",
    "claims_extraction",
    "decision_authority_extraction",
    "reference_resolution",
    "catalog_gap_detection",
    "authority_chain",
    "upstream_downstream_trace"
  ],
  "relationships": [],
  "provenance": {
    "source_system": "U.S. Code",
    "capture_method": "reference_ingestion_queue",
    "capture_notes": "Processed queue item ingest-usc-20-1681 rank 140; referenced by pl-118-31-fy2024-ndaa, public-law-115-232, usc-title-10-section-2031, usc-title-20-section-1001, usc-title-20-section-921, usc-title-5-section-601.",
    "api_record_url": null,
    "raw_text_url": null
  },
  "extraction_path": "artifacts/usc-title-20-section-1681/extractions/extractions.json",
  "claims_path": "artifacts/usc-title-20-section-1681/claims/claims.json",
  "reference_resolution_path": "artifacts/usc-title-20-section-1681/references/reference-map.json",
  "authority_chain_path": "artifacts/usc-title-20-section-1681/authority/authority-chain.json"
}
