{
  "id": "afmci-63-1201-life-cycle-systems-engineering",
  "title": "AFMCI 63-1201: Life Cycle Systems Engineering",
  "short_title": "AFMCI 63-1201",
  "artifact_type": "Air Force Materiel Command Instruction",
  "domain": "policy",
  "authority_level": "command_instruction",
  "hierarchy_rank": 88,
  "family": "acquisition",
  "jurisdiction": "Department of the Air Force",
  "issuing_authority": "Commander, Air Force Materiel Command",
  "issuing_organization": "Air Force Materiel Command",
  "source_system": "Air Force Materiel Command",
  "source_location_type": "afmc_pdf",
  "source_url": "https://static.e-publishing.af.mil/production/1/afmc/publication/afmci63-1201/afmci63-1201.pdf",
  "source_mime_type": null,
  "source_date": null,
  "publication_date": null,
  "effective_date": null,
  "captured_at": null,
  "checksum_sha256": null,
  "raw_path": null,
  "extracted_text_path": null,
  "metadata_path": "artifacts/afmci-63-1201-life-cycle-systems-engineering/metadata/metadata.json",
  "analytics_path": "artifacts/afmci-63-1201-life-cycle-systems-engineering/analytics/document-metrics.json",
  "analysis_path": "artifacts/afmci-63-1201-life-cycle-systems-engineering/analysis/machine-analysis.json",
  "structured_json_path": null,
  "version_index_path": "artifacts/afmci-63-1201-life-cycle-systems-engineering/versions/index.json",
  "pipeline_state": "source_known",
  "mirror_status": "blocked",
  "parser_status": "blocked",
  "review_status": "unreviewed",
  "tags": [
    "afmc",
    "systems-engineering",
    "acquisition",
    "life-cycle-management"
  ],
  "analytic_lanes": [
    "authority_lineage",
    "obligation_extraction",
    "deadline_detection",
    "defined_terms",
    "issuing_org_graph",
    "implementation_tasks",
    "supersession_tracking",
    "compliance_evidence",
    "entity_reference_concept_extraction",
    "line_annotation",
    "claims_extraction",
    "decision_authority_extraction",
    "reference_resolution",
    "catalog_gap_detection",
    "authority_chain",
    "upstream_downstream_trace"
  ],
  "relationships": [],
  "provenance": {
    "source_system": "Air Force Materiel Command",
    "capture_method": "official_source_registration",
    "capture_notes": "Official Air Force e-Publishing PDF endpoint returns an automated-access denial from this runtime."
  },
  "extraction_path": "artifacts/afmci-63-1201-life-cycle-systems-engineering/extractions/extractions.json",
  "claims_path": "artifacts/afmci-63-1201-life-cycle-systems-engineering/claims/claims.json",
  "reference_resolution_path": "artifacts/afmci-63-1201-life-cycle-systems-engineering/references/reference-map.json",
  "authority_chain_path": "artifacts/afmci-63-1201-life-cycle-systems-engineering/authority/authority-chain.json"
}
