{
  "id": "cyber-mil-cyber-awareness-challenge",
  "title": "DoD Cyber Awareness Challenge",
  "short_title": "Cyber Awareness Challenge",
  "artifact_type": "Implementation Guidance",
  "domain": "policy",
  "authority_level": "implementation_guidance",
  "hierarchy_rank": 85,
  "family": "cyber_training",
  "jurisdiction": "DoW/DoD",
  "issuing_authority": "DoW/DoD",
  "issuing_organization": "DoD Cyber Exchange",
  "source_system": "DoD Cyber Exchange",
  "source_location_type": "cyber_mil_html",
  "source_url": "https://www.cyber.mil/cyber-awareness-challenge",
  "source_mime_type": null,
  "source_date": null,
  "publication_date": null,
  "effective_date": null,
  "captured_at": null,
  "checksum_sha256": null,
  "raw_path": null,
  "extracted_text_path": null,
  "metadata_path": "artifacts/cyber-mil-cyber-awareness-challenge/metadata/metadata.json",
  "analytics_path": "artifacts/cyber-mil-cyber-awareness-challenge/analytics/document-metrics.json",
  "analysis_path": "artifacts/cyber-mil-cyber-awareness-challenge/analysis/machine-analysis.json",
  "structured_json_path": null,
  "version_index_path": "artifacts/cyber-mil-cyber-awareness-challenge/versions/index.json",
  "pipeline_state": "source_known",
  "mirror_status": "blocked",
  "parser_status": "blocked",
  "review_status": "unreviewed",
  "tags": [
    "dod",
    "dow",
    "cybersecurity",
    "training",
    "implementation-guidance"
  ],
  "analytic_lanes": [
    "authority_lineage",
    "obligation_extraction",
    "deadline_detection",
    "defined_terms",
    "issuing_org_graph",
    "implementation_tasks",
    "supersession_tracking",
    "compliance_evidence"
  ],
  "relationships": [],
  "provenance": {
    "source_system": "DoD Cyber Exchange",
    "capture_method": "manual_source_registration",
    "capture_notes": "Official source identified. Raw mirroring blocked by source host during automated capture."
  }
}
